rank,date_posted,definition,usage_example,up_votes,down_votes,posted_by,,
345,2013-02-28,"Generally a woman (though not always), who acts as an activist for Women's rights. There are three general types of feminists: Liberal, Socialist, and Radical Feminism. Liberal Feminists generally garner the most support, and attempt to rectify injustices suffered by women through conventional means. Socialist Feminists are a more radical form of liberal feminist that believe only a Socialist/Communist/Marxist revolution can truly stop gender inequality. Radical Feminists are extremely left wing, believing that only that the universal, surgical elimination of gender may bring about gender equality. Disclaimer: I am neither a female nor a feminist, simply someone wanting to give an unbiased definition of a word with a lot of exaggeration on both sides of the fence.","Liberal Feminist: Jenny, a liberal feminist, proudly supports her cause and frequently goes to rallies and protests. Socialist Feminist: ""DOWN WITH THE CAPITALIST EXPLOITATION OF WOMEN!"" Shouts Molly, a Socialist Feminist. Radical Feminist: ""Only through the surgical elimination of gender and the destruction of motherhood can all people be truly equal!"", says Paula, a Radical Feminist.",22,231,TheGrammargestapo,,
346,2014-12-28,"A person who believes in the social, political, and economical equality of the sexes. A feminist can be either a man or woman.",I am a feminist because I believe men and women should be equal,19,266,giraffe112,,
347,2015-11-02,"( Noun) Someone who believes that all genders are equal and that all genders should be treated the same as any other gender. (this includes transgender, Cisgender, Agender,gender fluid, ect.",I am a feminist.,9,110,BrokenGlass88,,
348,2018-12-15,"An anagram for ""I fist men"" hence the logo of a fist through a hole","The patriarchy says men are givers, not receivers, but I'm a feminist and I say otherwise",1,5,UpDoor,,
349,2017-12-10,"A person who subscribes to the horrid belief that women are human beings who deserve to be treated with respect and dignity, rather than gold-digging sluts, crazy bitches, harpy shrews, attention-seeking whores and vindictive liars who deserve to be insulted, degraded, ridiculed, abused, beaten, raped and murdered on a daily basis for the crime of having a vagina.","As the old feminist saying goes, ""If we get raped, it's our fault. If we get bashed, we must have provoked it. And if we raise our voices, we're nagging bitches.""",3,30,qbdkusoemv,,
350,2015-07-13,Being a feminist is when a woman being confident in who she is and doesn't need a mans opinion to justify between where she belongs. She is powerful and strong and believes that she is as equal as any man!,"Women are as equal as men, if this makes me a feminist so be it!",13,204,The Joker,,
351,2014-10-19,An individual who dares to support and/or advocate for gender equality.,Did you see that feminist over there? They think that people should be equal! How...how... scandalous!,15,271,Fish-k,,
352,2013-06-12,1 - Definition : A Feminist is a person that Believes in equal gender rights and it is the act of treating man and women as equals on everyday life. Most people are by definition feminists (in contrary to their own belief). 2 - Political Stance : People that refer to themselves as feminists because they think that women are oppressed and treated worse compared to men. Most people that refer to themselves as feminists in the western world are the exact opposite of the word feminist because they believe woman are oppressed or because they treat men different from women (henceforth their political agenda to improve women rights). Yes. The Political Stance on improving women rights that is called feminism (2) is technically anti-feministic (1) because it states that woman are treated unequal and because the stanceholder treats woman and man differently from eachother.,"(most likely a feminist) : ""I hate feminism because their all a bunch of man-hating dykes."" (anti-feminist) : ""Everybody hates me because I am a woman.""",15,281,Actual Interpretation,,
353,2015-03-07,"Someone who thinks logically about men and women having equal rights and women being treated as equals. Not to be confused with ""feminazi""",I'm a feminist but that doesn't mean I hate men,14,270,NuclearMuffinz,,
354,2015-05-25,"A feminist is a person who believes in equality for all, including race, sex, and gender. Their main focus is to raise women's rights, although it is equality. They also wish for people to express themselves with campaigns abolishing 'slut-shaming', the societal rejection of traditionally feminine clothing and/or emotional states shown on/by men, the female nipple ban on Instagram and other social media, and clothing/dress codes, to list several examples. They mostly are opposed to the ideology of a central patriarchy, but do not wish for there to be misandry OR misogyny.","The patriarchal society is inclusive to people largely rejecting ideas of traditionally feminine items of clothing on men, but feminists call an end to that.",11,209,elsewhereinabox,,
355,2015-07-18,"a person who believes in the social, political and economic equality of the sexes","(1) = Im a feminist, because i beleave that we are all equal! (2) = Okay? Who the fuck are you...",10,208,young east african girl,,
356,2020-08-24,A person of any gender who believes that any gender should display feminine traits and not be shamed for it.,We believe in feminist rights.,0,1,ReindeerFloattilla,,
357,2020-11-10,A person who simply seek for equal rights.,"So...Equal rights, equal fights. If a girl ever punched you, you gotta return it. If you ever heard anyone boasting about ""be a gentleman"", ""ladies first"" or anything female privileged, punch them and run, don't hesitate. John: Damn you punched her jaw off? Damn, you're a freakin' feminists bro.",0,0,KazumaKONOSUBA,,
358,2020-07-22,a person who supports feminism,"mason: i support women and all but like can't only women be feminists; a feminist: actually anyone can be a feminist it's about supporting women and wanting to be treated the same as a man and get everything a man gets for example equal pay, and the choice to do what we want with our bodies with out getting bashed on it by straight white men and Karens",0,5,badbitty420,,
359,2020-11-15,"A person who works and supports equal gender rights. No matter the gender, they believe all gender is equal and none should be treated as inferior. They support women's rights in making the world a gender equal place.","I'm a feminist, I support equal rights!",0,0,ari loves booty,,
360,2020-04-17,Social and political movements and ideologies that want to achieve equality for ALL sexes. Real feminists don't hate men,"Madison Beer is an open feminist, but you wouldn't hate on her because she is Madison Beer.",0,0,thanksforcomingtomytedtalk,,
361,2020-04-14,Someone who believes in the equality of the sexes,Barack Obama is a feminist,0,0,TooLesbianToFunction,,
362,2020-09-22,"A female who tries to tell you that females have historically faced more atrocities than males is plain full of shit, and has her own interests and self promotion in mind, not that of humanity. A female that thinks males haven't been butchered, beheaded, drawn and quartered, hanged, racked, boiled alive, sawed in half, burned alive, crucified, raped, tortured, or filled mass graves like numbers in the same numbers or many times higher numbers has forgotten history. Saying that males are oppressed, but females have been more oppressed is about the same thing, except it eliminates being held accountable for what she said about females having it worse throughout history (somebody letting her know she's full of shit) and still focusing attention on herself. Males lead violent, atrocious lives and it's never been a big deal, females have been more sheltered from it than any group throughout history, so that when atrocities do happen to females, the world stops to pay attention for some reason. It's rare to find a female child that got ass whoopings throughout her childhood from an authority figure, since nobody is more sheltered by and from authority figures and authoritarian values than females. Females who think their lives or childhoods were harder than their male counterparts because they can have children have forgotten what childhood was like, and have never really given much thought to the matter, they have their own interest in mind.","The girl didn't really have feminist interests, human interests, or any other interests than her own in mind with what she was trying to sell. She just told people she did.",0,1,Toejam Sr.,,
363,2020-11-30,A dumass women who thinks she knows everything but just wants more money,"All women are feminist and must stand up! ""Man, that sucks but I don't remember asking""",0,1,FlimFlop,,