rank,date_posted,definition,usage_example,up_votes,down_votes,posted_by,,
294,2020-09-22,"A female who tries to tell you that females have historically faced more atrocities than males is plain full of shit, and has her own interests and self promotion in mind, not humanity. A female that thinks males haven't been butchered, beheaded, drawn and quartered, hanged, racked, boiled alive, sawed in half, burned alive, crucified, raped, tortured, or filled mass graves like numbers in the same numbers or many times higher numbers has forgotten history. Saying that males are oppressed, but females have been more oppressed is about the same thing, except it eliminates being held accountable for what she said about females having it worse throughout history (somebody letting her know she's full of shit) and still focusing attention on herself. Males lead violent, atrocious lives and it's never been a big deal, females have been more sheltered from it than any group throughout history, so that when atrocities do happen to females, the world stops to pay attention for some reason. It's rare to find a female child that got ass whoopings throughout her childhood from an authority figure, since nobody is more sheltered by and from the same authority figures and authoritarian values they whine about being unfair to them than females. Females who think their lives or childhoods were harder than their male counterparts because they can have children have forgotten what childhood was like, and have never really given much thought to the matter, they have their own interest in mind.","The girl didn't really have feminist interests, human interests, or any other interests than her own in mind with what she was trying to sell. She just told people she did.",1,1,Toejam Sr.,,
295,2018-03-18,"A person (usually a woman) who pretends to want equality for women, but really just hate men, and only care for the women that agree 100% with them.","When the man breathes the feminist gets mad. When the man sits, the feminist gets mad when the man eats the feminist gets mad.",1,1,Maserati life,,
296,2019-07-26,i creature that came from hell and hates men and wants to kill them,help a feminist is trying to kill me,1,1,attack i pod lemon,,
297,2018-01-22,"Feminists are not man haters. It is not women who refuse to shave. It is not women who only get abortions and don't believe in relationships. We are women who want change not just for ourselves , but for everyone who has been underestimated and held back from equality. It's men and women fighting for gender equality.","He agrees that Olivia deserves to be equal to him, such a feminist he is.",1,1,womenlover101,,
298,2018-04-30,Josh: I'm going to a feminist rally; Amanda: what's feminism? Josh: supporters of equality based on gender,"Feminism is the act of wanting / supporting women. Feminism oppes for equal pay, equal respect, no sexual assault tolerance etc. if you agree in any of these... believe it or not your probably a feminist. Many people believe that feminist are just a bunch of man hating women however they word feminist is misunderstood. They are just people who believe in equality as any other descent person should. Ps: men can be feminist too!! 😋",1,1,Yo-yo lit and savage,,
299,2019-06-09,"A person who believes in the political, economic, and social equality of the sexes.","Karen: ""If you're a feminist then why do you hate men?!"" An intellectual: ""I don't.""",1,1,I couldn’t choose a name,,
300,2017-03-06,A Dumb Bitch.,She is a dumb bitch which is a feminists.,3,7,feminists hater,,
301,2017-02-28,"A person, not always of the female gender, who believes in EQUALITY between men and women. Sadly, a lot of people mistake them for being feminazis, or people ( once again not always girls ) that believe women are better than men, and they deserve to die.",Feminist: I think that men and women should be treated and respected the same. Femanazi: WHAT?!?! BUT MEN ARE PIGS WHO ARE USLESS AND DESERVE TO BURN IN THE PITS OF HELL!!!,3,7,Spicy bleach,,
302,2006-08-18,There are two types of feminist's 1) Someone who believes in equal rights and values for both genders. 2) Someone who believes in equal rights but still want men to do most of the work.,1. She wants equal rights and shares the responsibilitys of men that feminist is awesome. 2.Guy: She talked about equal rights then said i should pay for everything because im the man. Guy2: That was a bitch feminist mate.,94,494,James Haig,,
303,2016-04-07,"A smart person who knows what they're talking about. Feminists believe that all people deserve equal rights and equal treatment. They go against body and weight shaming and believe everyone is beautiful in their own way. Feminists are not just for woman's rights as believed by most people but are for the rights of all races from African American to Spanish, Caucasian, Asian and more. Also feminists respect non binary and binary people's pronouns ((he/she/them/they/it etc.)) . Also feminist are the ones who fight for gay, lesbian, pan, trans and so on's rights BUT that does not automatically mean all feminists are gay or pan or even a woman!! You can be classified as a feminist if you are boy, girl, or neither !!!! That's what's great!",Feminist: I fight for equality not just for woman but for everyone! That's what makes me a feminist!,4,11,Regionalatbest,,
304,2009-02-03,"a woman who, due to being deeply ashamed of her inability to make a good sandwich, tries to rationalize other reasons for having worth.....",Kate thought about killing herself after her husband told her she was crap in the kitchen... but then she just became a feminist instead,82,434,mickyjack,,
305,2017-11-16,"Meny people have different views on this, but this is my view of what a feminist is. A feminist is a person who believes in gender equality plain and simple not that one is better than the other but instead equal to one another.",I am a female and a feminist.,2,4,Edwards929,,
306,2016-10-24,Type of cancer.,She's a feminist because she hate mens,2,4,KILLMEH14,,
307,2018-11-17,"A true feminist is someone who is actively campaigning for men's and women's equality and rights so that both genders are treated the exact same, with respect. Despite popular belief, a feminist IS NOT someone who tries to tear down men and make women superior, nor visa versa. A feminist can be a man or a women. It does not make them less of a person based on their views.","Last week I saw a feminist campaigning for the gender pay cut to be abolished. I am a feminist raising the issue of men and boys being peer pressured into acting hard and showing no emotions, I find this concerning for young men's metal health!",2,4,The meaning,,
308,2016-04-04,"A person, typically a woman, who claims to support equal rights regarding sex and gender but are actually battling each other for the title of 'Most Opressed'. Someone who wishes to get rid of things that offend or trigger them, instead of realizing not everyone is going to be nice to you or have the same views. Feminists often advocate for minorities because they consider themselves to be involved in this group even if they are a wealthy white woman. They chant about respect towards black people, people within the lgbtq community (specifically variations of transgender and/or queer people), and all other races/genders/sexualities. But because of the display in which they show support, they hurt the validity and/or reputation of the groups they try to defend. Especially when they speak of a group they know little to nothing about or have no personal experience with. BUT ITS OKAY BECAUSE WOMEN ARE TOTALLY OPRESSED TOO IN MODERN DAY AMERICA !!",Young misguided feminist: There are so many things I want to do with my life that I can't because I'm oppressed every day by lack of non-sexual female representation in video games and the patriarchy. I'm totally not just limiting myself based on an ideology that has no place in the western world because everyone on tumblr agrees with me !,2,4,nervousyounginhuman,,
309,2018-07-14,The cum shot that should Of been swallowed,Your the cumshot I should of swollowed. Feminist is a crazy bitch that if you say your hugh mungus it will be classified as (sexual assault),2,4,Long schlong,,
310,2019-03-04,"A feminist is a woman who fights for equal rights for bolths genders. Most feminists are not popular in today's culture due to the idea that they are hipacrites or are going against the laws of nature. But that is not true, feminists want are equal pay for both sex's because statistics show for every dollar a man makes a woman earns 75 cents. feminists fight for equal rights because if you ask any girl you know, you daughter wife or mother, they will tell you they have been sexually harassed a least once. That includes being cat called on the street or being physically touched or mocked. Popular opinion often brings feminists down. People tell you feminism is wrong or feminists are sexist against men, it's not true, but what they don't tell you is that females are constantly treated unjustly due to there sex. People will try to keep that part hidden because they know it's wrong to be unjust against woman but they do it anyway. There is nothing wrong with wanting equal rights but people will blow it way out of proportion saying females and sometimes men will become feminists because they are weak, or peer pressure. it's not true. All feminists want are to be equally treated threw the good and the bad things. Feminists know that not every male is bad or did something, but feminists aren't fighting against men, they are fighting for equal rights. Feminism is about giving equal choice. It's about liberation and equality.","I did t know Sara was a feminist, that's great!!!!",2,4,Ollie08,,
311,2010-06-22,One who needs to stfu and go make me a sandwich,Feminist: RESPECT ME! Real Man: HAHAHAHA,78,428,Da Man Joe,,
312,2004-08-31,"1) n. A person who supports female equality. Few understand that by helping some sexist men without anger towards them, leads to a better society. The person with this attitude has the right idea. 2) adj. Has potential to be a bitch; The slightly less intellegent sister of the feminist who refuses to shave, wants pure equality and yet still expects the male to pay for her meals, open doors, etc... More than often ""feminazis"" are found at colleges harrasing men, and/or not shaving to completely destroy diversity. Many Women get confused on the matter and point out nearly ever male as a threat to the female, and constantly believe all they want is sex, without realizing the natural behavior some men go through. See bitch","The feminists were aiding the help of one confused man who was naturally too horny for society, while the feminazis bitched and complained over made up inequalities on campus.
",103,588,Job White,,
313,2006-08-28,"there are two types of femanists 1. a woman who believes in equal opportunity for men and women to thrive in the workplace and for other such good causes as right to choose and stopping domestic violence. they realize that women have come a long way in the past 30 years, and that now it is their job to wipe out such blemishes as wife-beating lowlife scum, or sister-fucking, Jesus-sucking rednecks who think that all we need to do is fuck to procreate, and then die. these are the good type of feminists. they dont need to belong to a femi-religious cult to be feminists, just donate a couple of bucks here and there. 2. the crazy assed feminazi cunt-dykes who have been done wrong by men, and can't seem to get out of the seventies. their visions of equality is a female dominated world in which men are used for fucking and lifting. they whine that men have better jobs than them just cuz there husband can't perform good enough in bed. they think that housewifes are man dominated scum that need to be liberated, not that a housewife is just as important to a family as a working mom and that when a woman wants to feel sexy, she should not be permitted to do so. they are not for female rights as much as they are for there woman dominated world","feminist #1: i feel feminism is a woman's right to choose, and if a woman wants to be a housewife, let her! Feminist #2: Housewifes are just man robots, and need to be freed, lets get out the bra burning machine again! were taking this shit '76 style!",91,527,12345432112345,,
314,2008-11-30,"far too often mistaken for the angry ignorant women that think they are superior to men and join clubs to complain. this is DUMB, and shameful. A true feminist takes on this title in an individualistic method. Sexism is a very interesting concept, and can NOT be blamed on men for it is the outcome of an unfair history. Things have come VERY far, and this is something to be very happy about. Modern sexism should be thought about in depth before any man or woman decides to become a feminist. The modern feminist believes in equality, which is OBVIOUS, but mainly respect. Woman are far too often not taken as seriously as men,(by both sexes), and examples of this can be found countless times in everyday life if you look for it. If you want to be feminist, don't be annoying, and PLEASE DO NOT say your feminist and then expect guys to carry your stuff/give you their coat/pay for everything/etc. It's hypocritical. Just respect yourself and expect respect from others as a human being, not an object, and not a hysterical emotional monster.","BAD feminist: ""BLAH BLAH WHINE BALH MEN SUCK! BLAH 75% OF PAY BLAH...pay for my dinner!"" GOOD feminist:""_______."" (doesn't have to say anything. Understands prejudices, and fights them by living his or her life without them.)",83,487,Himag,,
315,2009-03-16,A woman who doesn't shave her armpits.,My girlfriend is turning into a feminist!,68,416,ramifromsomewhere2,,
316,2017-08-01,someone who is mentally retarded,look at that feminist; god she is a feminist,2,5,Weedankers,,
317,2011-07-24,"A word that you'll get ten different definitions for if you ask ten different people to define it. Most likely, each person will be 100% sure theirs is the ""one true definition,"" and that all all other definitions are false.",Marcie: Vicky asked me whether or not I'm a feminist. Kyle: What did you say? Marcie: I asked her which definition of feminist she was using. There are millions of them.,60,409,Simple_As_Sun,,
318,2008-09-25,A girl who doesn't give blowjobs,That chick is such a feminist. She wouldn't even blow me a little before we banged.,85,653,ibman67,,
319,2017-10-02,a feminist is a person who hates men.,"boy ""did you hear the feminist"" girl ""no""",3,11,aragorn son of arathorn,,
320,2017-08-28,satans spawn,this person is a feminist,2,6,Feminist_killer,,
321,2016-02-04,An angry female with low self esteem and hairy legs who believes men to be superior and desires equality.,"Elizabeth hates men, razors and humour and is indeed a feminist.",2,6,MCRR,,
322,2013-11-03,someone who believes the radical notion that women are people.,"if you believe that women and men should have equal rights, you are a feminist. there's nothing ""extreme"" about it.",38,288,wolf15668,,
323,2018-09-26,A dumbass,"I'm a feminist and I'm proud! ""Yeah but you're also retarded...""",1,2,BigMancini,,
324,2017-07-18,"A person that fights for female rights; fem = female; ist = rights activist 2. used for females that ruin the reputation of the word, these females can fit in the following stereotypes * hates men * gets TRIGGERED over small things. * hates white people * calls white males CIS white SCUM","1. I fight for female rights so I consider myself a feminist 2. feminist: whats your name? guy: Hugh Mungus. feminist (TRIGGERED) SEXUAL ABUSE! youtuber commenting: look at that feminist, being triggered.",1,2,goanna678,,
325,2017-12-27,A feminist is a any body who believes in equality for all sexes,Being a feminist gives you a better outlook on life.,1,2,Candy121,,
326,2017-11-05,"Used to describe someone who is a radical leftist by someone who has a large lack of understanding of what leftism or politics is in general, usually 12-15 years old.",My English teacher gave us a lecture on white male privilege today. She's such a feminist!,1,2,bigheadu,,
327,2018-04-18,"A person who believes in equality for both men and women. Usually a women. Men will usually say that a feminist is someone who is a lesbian with short hair and low standards m, but reality is that men can also be femisnist. A feminist believes no gender is more superior than another","Uncultured Swine- look at Sally over there, she's such a feminist; Random Guy- she literally just wants equality pay, dude.",1,2,ImaGayyWooo,,
328,2019-01-05,Although many seem to believe that feminists are insane men haters that is simply not true. Feminists are people (men included) who believe women should be treated as equals. The crazy men haters people speak of are sexist women.,I am a feminist and there's nothing wrong with that.,1,2,Evil is a social construct,,
329,2020-02-22,Depends on the context. usually feminism means that women want to be better then men. However the real meaning is that both women and men wanna be equal,Ooh look a feminist is spouting nonsensical things about men; Look there is a feminist parade. Lets join in because everyone wants gender equality,1,2,A male human,,
330,2019-01-02,"a person, regardless of gender or sex, who believes in and supports equal rights for people of all genders. despite the widespread idea that feminism is about women's rights, it is really about equity as opposed to equality. Therefore, all people can be feminists by supporting rights and bringing people to an equal level.",both men and women can be proud feminists and know that they are doing good for the world and themselves,2,8,Heather and Liz,,
331,2017-02-05,"A person who sees women and men as equals (which is good), BUT a small percent of feminists are creations made by satan who are here to torture our existence and drive the human race mad.","Me: I play in a men's soccer league. Satan's creation: how dare YOU, you sexist peace of crap! Women's rights is a big problem in America and you should never... Me: (Why me god, why did you have to send a feminist to me.)",2,9,smartasian32,,
332,2018-05-17,Feminist is woman who knows she's better than a man. Feminism is a quality that only superior women possess. Anyone who understands that women are superior to men possess that special quality and therefore can be classified as feminist.,She's too good for you - she's a feminist; She doesn't give a fuck - she's a feminist,2,9,Boppin Bitch,,
333,2018-02-03,"Someone who believes that both genders should be equal. That's it. Feminists do not think they are better than men. That is a misandrist. Feminists believe that men and women have their own obstacles, some that are limited to gender. For example, it is a common misconception that guys cannot be raped. They can. It is also recognising the fact that women do get payed less because of their natural role in nature (pregnancy)which can often be interpretted as weakness. This is not right. Feminists are men and women who believe that one shouldn't be judged by their gender and that everyone, regardless of their gender can be themselves, be safe and express their emotions and opinions as they please. Misandry is not a characteristic of a feminist. It is another branch of sexism which feminism is against. The lie that all feminists are women trying to oppress men needs to stop. A feminist is a believer that men are just as valuable as women in society and vice versa. Nothing more.",I am a feminist because I want every gender to be equal.,1,3,Anonymous_626,,
334,2020-01-08,Generally a good hearted person believing in gender equality. Not to be confused with feminazi,Man: ah I see you are a feminist as well unlike this stupid feminazis,1,3,The_real_Napalm,,
335,2017-06-18,A member of a political movement for the advocation and advancement of women's rights and privileges.,"A Feminist march was started yesterday, protesting the lack of women in high level politics and business.",1,3,Lunacorva,,
336,2019-06-05,"A person, man or woman, who stands for the social political and economic equality of the sexes. They believe that men and women should be treated as equal human beings. Someone who identifies themselves as a feminist is someone of great courage, since the stereotype of this word has been twisted into something of opposite meaning. Small minded people believe feminism is only about advocating for women's rights over mens, or ""to find fault in everything a male does whilst believing all females can do no wrong"". This definition is only applied to 'Radical Feminists' who have a far different objective and do not stand for feminism. People are so angry to have a movement for the equality in the sexes that they redefined the word to have a terrible meaning that few truly believe.","Carmen went to the Pro-Choice March this Saturday, and she also went to the Awareness for Toxic Masculinity March as well, she must be a feminist. ""Of course she is! She advocates for rights in both sexes. The right for the freedom to a women's body and the awareness to the mentally straining stereotypes enforced on men.""",1,3,Katrina Mary,,
337,2017-11-23,A feminist is a person who believes all genders should be treated equally.,Tim was a feminist because women get 75 cents to every dollar a man gets.,1,3,Yiztu,,
338,2018-03-29,"A feminist is a person who believes that both misandry and misogyny are bad. Feminism is a movement that started in the 1960s and has continued into the modern world. Feminists are often misconstrued as 'man-haters', 'bitches' and 'women supremacists', however, these perspectives are formed in the minds of people who were misguided into believing that feminists are fascists. Feminism in its true form is a fight for equality and respect. Women and Men are different, but when doing the same jobs, putting in the same effort, there is no reason for there to be women being paid 70% of what men get in the workplace.","For those who were raised to believe that people who are feminists are evil or terrible people, simply google 'Mouvement de libération des femmes' - it was the peaceful protest of feminists in 1970s France. They were a group of feminists who fought for equality in the world. They broke the mould of women being the homemakers, of their destiny being 'to get married and have children'. List of true Feminists: Michelle Obama, Ellen Degeneres, Neil Patrick Harris, All of the Suffragettes, Simone de Beauvoir, Eleanor Roosevelt, Mark Ruffalo, Ashton Kutcher, Ryan Gosling, Harry Styles, Andy Samberg, ",1,3,Alaric47,,
339,2018-12-15,"An anagram for ""I fist men"" hence the logo being a fist through a hole","The patriarchy says men are givers, not receivers, but I'm a feminist and I say otherwise.",1,3,UpDoor,,
340,2020-09-03,"all the definitions here are absolute fucking bullshit. a feminist is a person who believes women and men should have equal rights. that's literally it. all the people writing definitions on this page are pissbabies who think women only exist to have sex with them, and now they're fucked off that people are actively taking a stand against that because it means they can't openly objectify women's bodies anymore.","person: yeah, i'm a feminist! i think women and men should have equal rights - some random guy: WHEN WILL THIS MISANDRY END???? FEMINISTS ARE SO SEXIST AHAHAHAHA MAKE ME A SANDWICH",1,3,lydia grace,,
341,2019-05-31,"A person who believes in the political, social, economic, and personal equality of the sexes.",I am a feminist because I don't want to live like I'm in A Handmaid's Tale.,1,3,jabberbox1234,,
342,2020-04-13,"A person of any gender, who chooses to believe men are equal to women and women should have as much choice as a man has.",I am a feminist because men shouldn't be allowed to treat women disrespectfully and abuse against men shouldn't be dismissed,1,3,Votechange,,
343,2019-03-07,"A woman or man who believes it should be equal rights for both gender. That nether gender should have special treatment or be treated any differently because of there gender and that a woman should not be sexualized and thought of as property to a man. Women should not be thought of as a ""slut"" or a ""hoe"" just because she is wearing a tight top and shorts, no means no and men and women need to understand that rape is not okay, and feminist (men and women) are trying to stop it and make the world a better place where everyone has equal rights.","Dan- ""omg I heard that girls a feminist lol"" Rob- ""ya same. Yanno I'm a feminist?"" Dan- ""guys can't be feminists, that just means you hate men"" Rob- ""hell ya I can be a feminist. It dose not mean I hate men, I just believe in equal rights""",1,3,Feminisity101,,
344,2018-01-13,"someone, of either gender, who believes that men can express emotion and women can work in ""masculine"" jobs for equal pay. Non-feminist parent:""stop being a girl, boys dont cry""","son: "" she broke my heart dude""",1,3,wigglemytoesinthecushion,,
